{
  "schema": "screen_verdict@1",
  "run_id": "run-20261022-a1",
  "key": "doi:10.1000/example.seasonal",
  "decision": "exclude",
  "reason": "Seasonal outlooks, not nowcasting.",
  "score": 0.06,
  "model": "strata-qwen",
  "batch_id": "b1",
  "plan_version": 1,
  "created_at": "2026-10-22T10:02:00Z"
}
